titre,categorie,sous_categorie,destination,lieu,url,prix_des,duree,age_min,niveau,politique_annulation,langues,point_de_rdv,comprend,ne_comprend_pas,a_prevoir,pre_requis,conditions_particulieres,organisateur,note,nb_avis,points_forts,resume,seo_title,slug,meta_description,image_url_1,image_url_2,image_url_3
Cours de surf à Saint-Leu,Eau,Surf,Île de la Réunion,Saint-Leu - Trois Bassins,https://www.manawa.com/fr-FR/activite/ile-de-la-reunion/baie-de-saint-leu/surf/cours-de-surf-aux-trois-bassins-a-la-reunion/12779?_cid=1985,Dès 65 €,2 h,12 ans,Accessible à tous,Flexible,"français, anglais","Spot de Saint-Leu, côte ouest","Planche de surf, combinaison, encadrement par moniteur diplômé","Transport, photos","Maillot de bain, serviette, crème solaire, bouteille d'eau","Savoir nager, conditions météo et vigies requins favorables",Activité soumise aux vigies requins et conditions météo,École de Surf de la Réunion,4.8/5,25,"Spot mythique, encadrement professionnel, cours collectifs ou privés",Initiez-vous au surf sur le spot mythique de Saint-Leu. Cours collectifs ou privés adaptés à tous niveaux.,Cours de surf à Saint-Leu - Réservation tarifs et avis,cours-surf-saint-leu-reunion,Apprenez le surf à Saint-Leu avec des moniteurs diplômés. Cours collectifs ou privés sur spot mythique. Réservez dès 65€.,"https://res.cloudinary.com/manawa/image/private/f_auto,c_limit,w_1080,q_auto/dac5cebea79c1ebcd2ce0e30b265f7a4","https://res.cloudinary.com/manawa/image/private/f_auto,c_limit,w_3840,q_auto/zxofxgakl45amzpr5n9n","https://res.cloudinary.com/manawa/image/private/f_auto,c_limit,w_3840,q_auto/nfyuuczwgbehmpcn0syy"
Saut à l'élastique Pont du Bras de la Plaine 115m,Crazy,Saut à l'élastique,Île de la Réunion,Saint-Pierre - Pont du Bras de la Plaine,https://www.manawa.com/fr-FR/activite/ile-de-la-reunion/saint-pierre/saut-a-l-elastique/saut-a-lelastique-du-pont-du-bras-de-la-plaine-115-m-la-reunion/11791?_cid=1985,Dès 115 €,1 h,16 ans,Accessible à tous,Flexible,"français, anglais","Pont du Bras de la Plaine, Saint-Pierre","Équipement de sécurité, harnais, briefing sécurité, encadrement professionnel","Transport, photos/vidéos personnelles","Tenue de sport, chaussures fermées","Poids maximum 120kg, pas de problèmes cardiaques",Activité soumise aux conditions météorologiques,Verti'kal Jump Réunion,4.8/5,25,"115m de hauteur, paysages époustouflants, sensations extrêmes",Saut à l'élastique depuis le pont du Bras de la Plaine à 115m de hauteur. Sensations garanties dans un cadre naturel exceptionnel.,Saut élastique 115m Pont Bras de la Plaine - Réservation tarifs et avis,saut-elastique-pont-bras-plaine-reunion,Saut à l'élastique de 115m au pont du Bras de la Plaine. Sensations extrêmes et paysages grandioses. Réservez dès 115€.,"https://res.cloudinary.com/manawa/image/private/f_auto,c_limit,w_1080,q_auto/2d9295ad539401d1e3cfa969917d63bc","https://res.cloudinary.com/manawa/image/private/f_auto,c_limit,w_3840,q_auto/ec6c243bf9199b944a24e8cbd1bbc5c7","https://res.cloudinary.com/manawa/image/private/f_auto,c_limit,w_3840,q_auto/1137fc5435ff6e26c3132f01760623e9"
Randonnée à cheval sportive Piton Maïdo,Terre,Équitation,Île de la Réunion,Saint-Paul - Piton Maïdo,https://www.manawa.com/fr-FR/activite/ile-de-la-reunion/maido-saint-paul/balade-a-cheval/randonnee-a-cheval-sur-le-piton-maido-la-reunion/11708?_cid=1985,Dès 85 €,3 h,14 ans,Sportif occasionnel,Flexible,"français, anglais, allemand, italien","Les Chevaux du Maïdo, Saint-Paul","Cheval adapté au niveau, encadrement professionnel, casque","Transport, assurance personnelle","Pantalon long, chaussures fermées, veste chaude","Expérience équestre requise, poids maximum 90kg",Activité soumise aux conditions météorologiques,Les Chevaux du Maïdo,4.8/5,22,"Panoramas exceptionnels, chevaux de qualité, guides passionnés",Randonnée équestre sportive près du Piton Maïdo pour cavaliers expérimentés. Panoramas à couper le souffle à 2200m d'altitude.,Randonnée cheval sportive Piton Maïdo - Réservation tarifs et avis,randonnee-cheval-piton-maido-reunion,Randonnée à cheval sportive au Piton Maïdo pour cavaliers expérimentés. Panoramas exceptionnels à 2200m. Réservez dès 85€.,"https://res.cloudinary.com/manawa/image/private/f_auto,c_limit,w_3840,q_auto/8118c6965ca51895dccc6a5d1831da62","https://res.cloudinary.com/manawa/image/private/f_auto,c_limit,w_1920,q_auto/04a3484c7a85b825b2f339e7665adde7","https://res.cloudinary.com/manawa/image/private/f_auto,c_limit,w_3840,q_auto/o2rbzhjtfbgfrg5laqbs"
Vol hélicoptère Piton de la Fournaise 25 min,Air,Hélicoptère,Île de la Réunion,Saint-Pierre - Aéroport Pierrefonds,https://www.manawa.com/fr-FR/activite/ile-de-la-reunion/saint-pierre/helicoptere/vol-en-helicoptere-au-dessus-du-piton-de-la-fournaise-la-reunion/9647?_cid=1985,Dès 165 €,25 min,3 ans,Accessible à tous,Flexible,"français, anglais",Aéroport Saint-Pierre Pierrefonds,"Vol en hélicoptère, pilote professionnel, commentaires du pilote, café/thé","Transport jusqu'à l'aéroport, photos personnelles","Appareil photo, lunettes de soleil, vêtements chauds",Poids maximum 120kg par passager,Vol soumis aux conditions météorologiques,Hélilagon,4.7/5,21,"Survol volcan actif, cascades Langevin, retour face au lagon","Survol exceptionnel du Piton de la Fournaise en hélicoptère. Découvrez le volcan actif, ses cratères et cascades depuis les airs.",Vol hélicoptère Piton de la Fournaise 25min - Réservation tarifs et avis,vol-helicoptere-piton-fournaise-reunion,"Survol du Piton de la Fournaise en hélicoptère 25min. Volcan actif, cratères et cascades vus du ciel. Réservez dès 165€.","https://res.cloudinary.com/manawa/image/private/f_auto,c_limit,w_3840,q_auto/da61a49ebf6028ce51117bed1e7896bb","https://res.cloudinary.com/manawa/image/private/f_auto,c_limit,w_3840,q_auto/262761fbde66e32e9a0fffeab5ef122f","https://res.cloudinary.com/manawa/image/private/f_auto,c_limit,w_3840,q_auto/97a2a525737987d871d2b7b5b69f97d2"
Excursion quad Rivière des Remparts,Terre,Quad,Île de la Réunion,Saint-Joseph - Rivière des Remparts,https://www.manawa.com/fr-FR/activite/ile-de-la-reunion/riviere-langevin-saint-joseph/quad-buggy/excursion-guidee-en-quad-pres-de-la-riviere-des-remparts-la-reunion/14276?_cid=1985,Dès 75 €,De 1 h à 3 h,16 ans,Accessible à tous,Super flexible,"français, anglais, espagnol, chinois","Base Saint-Joseph, à 200m du chemin tout-terrain","Quad, équipement de sécurité, guide, photos et vidéos WhatsApp","Transport, assurance personnelle","Vêtements de rechange, lunettes, chaussures fermées","Permis de conduire, poids maximum 120kg","3 parcours selon niveau : 1h, 2h ou 3h",Sud Aventures Quad,4.8/5,20,"3 parcours au choix, photos/vidéos offertes, paysages sauvages",Excursion quad guidée dans la vallée sauvage de la Rivière des Remparts. Trois parcours selon votre niveau.,Excursion quad Rivière des Remparts - Réservation tarifs et avis,excursion-quad-riviere-remparts-reunion,"Excursion quad guidée Rivière des Remparts. 3 parcours 1h à 3h. Paysages sauvages, photos offertes. Réservez dès 75€.","https://res.cloudinary.com/manawa/image/private/f_auto,c_limit,w_1080,q_auto/46810400acc60e662ee7c9dfd72895bb","https://res.cloudinary.com/manawa/image/private/f_auto,c_limit,w_1080,q_auto/bq32wudalfit7hhotp28","https://res.cloudinary.com/manawa/image/private/f_auto,c_limit,w_1080,q_auto/087a0c2f6d67d8726450752cfae32749"
Location quad autonome Piton de la Fournaise,Terre,Quad,Île de la Réunion,Piton de la Fournaise - Plaine des Sables,https://www.manawa.com/fr-FR/activite/ile-de-la-reunion/piton-de-la-fournaise/quad-buggy/location-de-quad-au-piton-de-la-fournaise-la-reunion/13244?_cid=1985,Dès 120 €,3 h,18 ans,Accessible à tous,Flexible,français,"Base Bourbon Excursions, route du volcan","Quad, casque, itinéraire détaillé, briefing sécurité","Carburant, assurance casse, guide","Permis de conduire, vêtements chauds, lunettes","Permis de conduire obligatoire, expérience souhaitée","Location autonome, itinéraire fourni",Bourbon Excursions,4.8/5,14,"Autonomie totale, traversée Plaine des Sables, pas de Bellecombe",Location de quad en autonomie pour explorer le Piton de la Fournaise. Traversez la mythique Plaine des Sables.,Location quad Piton de la Fournaise - Réservation tarifs et avis,location-quad-piton-fournaise-reunion,"Location quad autonome 3h au Piton de la Fournaise. Traversée Plaine des Sables, pas de Bellecombe. Réservez dès 120€.","https://res.cloudinary.com/manawa/image/private/f_auto,c_limit,w_3840,q_auto/f451cfd4bf17db88b4e0b4665357203f","https://res.cloudinary.com/manawa/image/private/f_auto,c_limit,w_3840,q_auto/1327762c2be98ab58070658085dbcf73","https://res.cloudinary.com/manawa/image/private/f_auto,c_limit,w_3840,q_auto/d0efc63f45044b1addb148bd4afab43f"
Location stand up paddle Saline-les-Bains,Eau,Stand Up Paddle,Île de la Réunion,La Saline-les-Bains - Lagon Saint-Gilles,https://www.manawa.com/fr-FR/activite/ile-de-la-reunion/lagon-de-saint-gilles/stand-up-paddle/location-de-stand-up-paddle-a-la-saline-les-bains-la-reunion/12316?_cid=1985,Dès 20 €,De 30 min à 2 h,16 ans,Accessible à tous,Super flexible,"français, anglais","Plage Petit Trou d'Eau, La Saline-les-Bains","Planche SUP, pagaie, leash, briefing et conseils d'itinéraires","Combinaison, transport, assurance","Maillot de bain, crème solaire, eau, masque et tuba optionnel",Savoir nager obligatoire,"3 durées au choix : 30min, 1h ou 2h",Lagon Bleu Réunion,4.8/5,13,"Lagon turquoise, observation tortues, activité écologique",Location de stand up paddle en autonomie sur le lagon de Saint-Gilles. Explorez les eaux turquoise et observez la vie marine.,Location SUP Saline-les-Bains lagon - Réservation tarifs et avis,location-sup-saline-bains-reunion,"Location stand up paddle lagon Saint-Gilles. 30min à 2h en autonomie, eaux turquoise, tortues marines. Réservez dès 20€.","https://res.cloudinary.com/manawa/image/private/f_auto,c_limit,w_1080,q_auto/558a99bea4e08064743f2ed00c29dc82","https://res.cloudinary.com/manawa/image/private/f_auto,c_limit,w_1080,q_auto/elxwcafmkcfgcqv5hzzp","https://res.cloudinary.com/manawa/image/private/f_auto,c_limit,w_1080,q_auto/7e227bc7412d41b409e02b1d601b65d7"
Randonnée volcan Piton de la Fournaise,Terre,Randonnée,Île de la Réunion,Piton de la Fournaise - Pas de Bellecombe,https://www.manawa.com/fr-FR/activite/ile-de-la-reunion/piton-de-la-fournaise/randonnee/randonnee-au-volcan-du-piton-de-la-fournaise-la-reunion/11725?_cid=1985,Dès 65 €,6 h,12 ans,Sportif,Flexible,"français, anglais",Musée du Volcan à Bourg-Murat,"Guide accompagnateur en montagne diplômé, explications géologiques","Déjeuner, transport (votre véhicule requis)","Chaussures de randonnée, k-way, polaire, crème solaire, 2L d'eau, pique-nique","Bonne condition physique, minimum 4 participants",Randonnée hors sentier balisé jusqu'au sommet,Rando Volcan Réunion,4.8/5,19,"Sommet du volcan, cratère Dolomieu, paysage lunaire",Randonnée de 6h jusqu'au sommet du Piton de la Fournaise. Découvrez le cratère Dolomieu et les paysages lunaires du volcan actif.,Randonnée Piton de la Fournaise sommet - Réservation tarifs et avis,randonnee-piton-fournaise-sommet-reunion,"Randonnée 6h au sommet du Piton de la Fournaise. Cratère Dolomieu, paysages lunaires, guide expert. Réservez dès 65€.","https://res.cloudinary.com/manawa/image/private/f_auto,c_limit,w_1080,q_auto/fefabf0b50a500ab8e257c51350c5e83","https://res.cloudinary.com/manawa/image/private/f_auto,c_limit,w_1080,q_auto/9f5d8e1be8b2524d14dd49d73e17ed3a","https://res.cloudinary.com/manawa/image/private/f_auto,c_limit,w_1080,q_auto/5cba197398f5257bdb5f3788c3d6d5ef"
Randonnée aquatique rivière des Roches,Eau,Canyoning,Île de la Réunion,Saint-Benoît - Bassin La Paix,https://www.manawa.com/fr-FR/activite/ile-de-la-reunion/riviere-des-marsouins-saint-benoit/canyoning/randonnee-aquatique-dans-la-riviere-des-roches-la-reunion/6474?_cid=1985,Dès 45 €,3 h,12 ans,Accessible à tous,Flexible,"français, anglais, espagnol","Bassin La Paix, entre Bras-Panon et Saint-Benoît","Combinaison néoprène intégrale, gilet, casque, guide certifié, apéro","Transport, chaussures aquatiques","Maillot de bain, serviette, baskets aquatiques, bouteille d'eau, en-cas","Savoir nager obligatoire, bonne santé physique","2 sauts obligatoires de 3m, sauts facultatifs jusqu'à 11m",Rando Aqua Réunion,4.8/5,24,"Sauts et glissades, eau vive, environnement préservé","Randonnée aquatique ludique dans la rivière des Roches. Descendez bassins et cascades en nageant, sautant et glissant.",Randonnée aquatique rivière des Roches - Réservation tarifs et avis,randonnee-aquatique-riviere-roches-reunion,"Randonnée aquatique rivière des Roches. Sauts jusqu'à 11m, glissades naturelles, eau vive. Guide expert. Réservez dès 45€.","https://res.cloudinary.com/manawa/image/private/f_auto,c_limit,w_1080,q_auto/9d1e07d14c16e3211240cb542a925f42","https://res.cloudinary.com/manawa/image/private/f_auto,c_limit,w_1080,q_auto/61ed650f04b06236aae305cb833db352","https://res.cloudinary.com/manawa/image/private/f_auto,c_limit,w_1080,q_auto/159ae09bc54e83ccf1f303106cdb7da7"
